"","joe_issue_ID","jp_id","jp_section","jp_institution","jp_division","jp_department","jp_keywords","jp_title","jp_full_text","jp_salary_range","jp_agency_insertion_num","jp_new","locations","JEL_Classifications","Application_deadline"
"75","2018-02",111461722,"Other Nonacademic (Temporary, Part-Time, Non-Salaried, Consulting, Etc.)","RAND Corporation",NA,"Economics, Sociology and Statistics","Aging
Economics
Health Economics
Postdoctoral Fellowships
Demography","Postdoctoral Fellowship in the Study of Aging","RAND is accepting applications for one or more postdoctoral fellowships in the Study of Aging. This program enables outstanding scholars to sharpen their analytic skills and advance their research agenda in the field of aging. Scholars come from various disciplines including economics, demography, sociology, and psychology.

Housed within RAND's Social and Behavioral Policy Program, the program blends formal and informal training and extensive collaboration with distinguished researchers without teaching obligations. One-year fellowships are renewable for a second year and provide a stipend and health insurance.

Fellows must be U.S. citizens or permanent residents, and must have completed a Ph.D. in a relevant discipline before they begin the program. The program is open to new scholars, as well as individuals who have some research experience or are on leave from an academic position.

Application review begins January 31, 2019. 

Additional information and application materials are available at http://www.rand.org/labor/fellows/aging.html 

or by contacting: 

Cary Greif
RAND Corporation
1776 Main Street, Santa Monica, CA 90407-2138
310-393-0411 x6219 
email: cary_greif@rand.org 

or by emailing the Associate Program Director, Kathleen_Mullen@rand.org.  

RAND is an Equal Opportunity Employer Minorities/Females/Vets/Disabled
","$50-59,999",NA,NA,"UNITED STATES California Santa Monica","J - Labor and Demographic Economics","2019-01-31 00:00:00"
"76","2018-02",111461751,"US: Full-Time Academic (Permanent, Tenure Track or Tenured)","Randolph College",NA,"Economics and Business","Microeconomics, Business, Marketing

","Assistant Professor of Economics and Business (Tenure Track)","The Department of Economics and Business at Randolph College (http://www.randolphcollege.edu) invites applications for a tenure-track position at the assistant professor level. Preference will be given to those who demonstrate quality teaching and an appreciation for the liberal arts, and who have a doctorate in economics or business administration completed by September 1, 2019.  The college teaching load is 3 courses per semester. Date of employment is July 1, 2019; report date is in mid-August.

We seek a colleague with competencies to teach in both economics (microeconomics) and business administration (marketing).  Specific needs include introductory and intermediate microeconomics and marketing, as well as both business administration and economics electives and support of the senior programs in both majors. 

Located in the shadow of the Blue Ridge Mountains in Lynchburg, Virginia, Randolph College, founded in 1891 as Randolph-Macon Woman<U+2019>s College, is a traditional small liberal arts college with a longstanding reputation for excellence in teaching and an appreciation for and commitment to diversity.  

To apply, please send the following materials to econbussearch@randolphcollege.edu by December 5, 2018: (1) a letter of interest in Randolph College, (2) CV, (3) teaching evaluations, (4) a philosophy of teaching statement, (5) graduate transcript, and  (6) three letters of recommendation (one of which must address teaching competence). The cover letter should indicate the range of elective courses you would be willing to teach.  Candidates chosen to be interviewed will be contacted by phone. Randolph is an EOE M/F/D/V employer. 


",NA,NA,NA,"UNITED STATES Virginia Lynchburg","A - General Economics and Teaching
D - Microeconomics
M - Business Administration and Business Economics; Marketing; Accounting; Personnel Economics","2018-12-05 00:00:00"
"77","2018-02",111461775,"International:Full-Time Academic (Permanent, Tenure Track or Tenured)","Renmin University of China",NA,"School of Agricultural Economics and Rural Development","Renmin University of China
Agricultural Economics
Resource Economics
Development Economics
Environmental and Ecological Economics
Agri-business
Food policy","Assistant Professor/Associate Professor/Professor","The School of Agricultural Economics and Rural Development (SARD) at Renmin University of China is one of the top programs in applied economics, agricultural economics and agri-business.

Our school is offering a couple of positions at all levels. Candidates are required to have a Ph.D. (or expected completion in 2019) and have a strong background in economics, agricultural economics, agri-business or related areas. Salaries and benefits are competitive and commensurate with qualifications and experience. 

Interested and qualified applicants should send their application materials (including a cover letter, CV, and three reference letters) to lujie@ruc.edu.cn.

Candidate interviews will be conducted on 2019 AEA Conference or by online video. All positions should be applied for by Jan.15th, 2019.

For more information about the SARD, please visit our web page: http://www.sard.ruc.edu.cn/
",NA,NA,NA,"CHINA Beijing","H - Public Economics
M - Business Administration and Business Economics; Marketing; Accounting; Personnel Economics
Q - Agricultural and Natural Resource Economics; Environmental and Ecological Economics
R - Urban, Rural, Regional, Real Estate, and Transportation Economics","2019-01-15 00:00:00"
"78","2018-02",111461738,"Full-Time Nonacademic","Research Affiliates","Research and Investment Management","Research","Finance
Investment Management","Senior Researcher","Research Affiliates is committed to being the preeminent source of insights and products that transform the global investment community for the benefit of investors. Demonstrating our strong research focus, RA partners with some of the world<U+2019>s leading financial institutions to distribute market-changing products in quantitative fundamental equities, systematic quantitative investing, and tactical asset allocation. Our high-reaching edge is the strength of our research, our product development capabilities, and our focus on culture. We support principles of sustainability and diversity.

The primary responsibilities of a Senior Researcher may include: applying quantitative research techniques to better understand the drivers of risk and return across and within financial markets; analyzing and developing new quantitative investment strategies; communicating this research clearly through writing and/or public speaking; and crafting these insights into market-impacting products. You should possess Ph.D. level training in financial economics, empirical asset pricing, and econometrics. Proficient programming and data management skills are needed. You should expect to collaborate with others on long-term research projects and possess strong teamwork skills, with the ability and desire to actively discuss both theories and empirical methods with the broad research team. 

Those who match Research Affiliates cultural values will possess curiosity and a willingness to continually learn, show up authentically, take responsibility for their actions, and be strong collaborators both within and outside the firm.

Roles and Responsibilities: 
<U+2022>	Work on directed projects in quantitative strategies assigned by the research team managers
<U+2022>	Publish articles in practitioner journals and present research at internal seminars and external conferences
<U+2022>	Assist in due diligence meetings to provide technical support to client facing team

Education and Experience:
<U+2022>	Ph.D. Degree in Finance, Economics, or other quantitative field
<U+2022>	Experience as research assistant to finance or economics professors helpful
<U+2022>	Strong written and verbal interpersonal skills
<U+2022>	Strong intuition of capital markets and theoretical investment concepts
<U+2022>	Team player and able to effectively and efficiently lead in a collaborative environment

We will conduct interviews with selected candidates at the 2019 AEA/AFA meeting.

Please submit resumes (if available, include job market paper and letters of recommendation) via e-mail using the subject line <U+201C>AFA 2019<U+201D> to:
RIMresume@rallc.com

","Competitive",NA,NA,"UNITED STATES California Newport Beach","00 - Default: Any Field","2018-12-15 00:00:00"
"79","2018-02",111461809,"US: Full-Time Academic (Permanent, Tenure Track or Tenured)","Seton Hall University",NA,"Economics and Legal Studies","Macroeconomics
Open Fields","Assistant Professor of Economics","Seton Hall University<U+2019>s Stillman School of Business is searching for a tenure-track assistant professor of economics to start in the fall of 2019, pending budgetary approval. An ideal candidate will have a PhD in Economics from an accredited university and be able to teach principles, intermediate macroeconomics, and at least one other course in the candidate<U+2019>s field of expertise (to complement our current offerings). The teaching load is a 3/3, with a maximum of two preparations per semester. We are looking for someone who can balance excellence in teaching with an active research portfolio, along with having some engagement in the school and university community.

Seton Hall University is located on a 58-acre suburban campus in South Orange, New Jersey, just 14 miles from New York City and is the oldest Catholic diocesan institution of higher education in the United States. 

Seton Hall University is an Equal Opportunity/Affirmative Action employer. It honors diversity and respects the religious commitments of all its employees. In turn, its employees respect Catholic beliefs and values, and they support its mission as a Catholic institution of higher education.
",NA,NA,NA,"UNITED STATES New Jersey South Orange","E - Macroeconomics and Monetary Economics
00 - Default: Any Field",NA
"80","2018-02",111461798,"International:Full-Time Academic (Permanent, Tenure Track or Tenured)","Shenzhen University",NA,"China Center for Special Economic Zone Research","Industrial Organization, Labor Economics, Econometrics, Public Economics, History of Economic Thought, China Economics","Assistant Professor","China Center for Special Economic Zone Research at Shenzhen University warmly invites applications for assistant professor in all fields of economics.

Candidates should have a Ph.D. already in hand or firmly expected by August 2019. Applicants must submit a cover letter, curriculum vitae, three letters of recommendation and job market paper(s) at sez@szu.edu.cn before Dec.22, 2018. 

The university offer competitive salaries, benefits and research support. Shenzhen city government also provides competitive housing subsidies. To know more about the center, please visit http://www.ccsezr.org.cn/",NA,NA,NA,"CHINA Shenzhen","00 - Default: Any Field","2019-01-31 00:00:00"
"81","2018-02",111461820,"International:Full-Time Academic (Permanent, Tenure Track or Tenured)","Soochow University",NA,"Department of Economics","Macroeconomics; Monetary Economics; International Finance; Econometrics; Industrial Economics; Public Economics","Assistant Professor or Above, Tenure-Track or Project-Based","The Department of Economics at Soochow University invites applications for full-time faculty positions at assistant professor level or above. Applicants should have Ph.D. degrees before June, 2019, and should demonstrate strong potential and interest in research and teaching. Language requirement: English or Mandarin. 

Position Title: Assistant Professor or above, Tenure-Track or Project-Based.

Research Field: Any Field is welcome, but priority will be given to Macroeconomics, Monetary Economics, International Finance, Econometrics, Industrial Economics, and Public Economics.

Application Requirements:
Cover Letter
CV
Job Market Paper
Transcripts
Research Papers
Relevant teaching materials
3 Letters of Reference

Please send your application documents by mail to:
Recruiting Committee, Department of Economics, Soochow University
No. 56, Sec. 1, Kwei-Yang Street, Taipei, 10048 TAIWAN

Application deadline: 01/30/2019
",NA,NA,NA,"TAIWAN Taipei","00 - Default: Any Field","2019-01-30 00:00:00"
"82","2018-02",111461702,"US: Full-Time Academic (Permanent, Tenure Track or Tenured)","Southern Utah University","Dixie L. Leavitt School of Business","Economics and Finance","Lecturer of Economics","Lecturer in Economics","The Department of Economics and Finance at the Dixie L. Leavitt School of Business at Southern Utah University is seeking applicants for a full-time lecture position. With a university focus on experiential learning, we are looking for candidates that can provide quality experiences in the undergraduate curriculum. Expected course load is 5 courses a semester with an average class size of around 40. Course assignment will be based on experience and expertise. In addition to offering core courses in Economics, the department offers a course called US Economic History which fills an American Institutions general education requirement. Our undergraduate degree has a quantitative emphasis and also services the Data Analytics and MBA programs. 

Other responsibilities consist of mentoring and engaging with students in alignment with the mission and vision of the University. 

Qualified candidates will have
1. Master<U+2019>s degree or PhD in Economics or related field
2. Ability to provide an excellent educational experience for students
3. Willingness to contribute to the department and college

Priority will be given to applications arriving before December 15, 2018
","Commensurate with experience",NA,NA,"UNITED STATES Utah Cedar City","00 - Default: Any Field
A - General Economics and Teaching",NA
"83","2018-02",111459556,"US: Full-Time Academic (Permanent, Tenure Track or Tenured)","Southwestern University of Finance and Economics",NA,"School of Securities and Futures","Finance
Economics
Data Science","Assistant Professor","Qualifications: Applicants are expected to engage in quality research and teaching. A successful applicant should have a Ph.D. or is expected to receive one from a strong program in the field of, but not limited to, Finance or Economics. We also encourage those with a concentration in Statistics/Computer Science/Mathematics and substantial experience in financial industry to apply. Senior applicants should have excellent records on research and teaching.

Job Responsibility: Engagement in quality research and teaching is expected.

The University: Southwestern University of Finance and Economics is a premiere university under the administration of the Ministry of Education of the Peoples Republic of China. The university is also among the elite one hundred Chinese universities chosen to engage in fundamental and leading research in the 21st century (Project 211).

Compensation: Peer school competitive

Application: To apply, please submit a curriculum vita to zhangteng@swufe.edu.cn. For best consideration, please apply as early as possible. We will be attending the 2019 ASSA annual meeting. We will keep you posted on our itinerary and schedule. 

Tel: 86-28-87092076, 86-28-87352750
Fax: 86-28-87092076,
Email: zhangteng@swufe.edu.cn
wecaht:tz_swufe

For more information, please visit http://zqxy.swufe.edu.cn/",NA,NA,NA,"CHINA Sichuan Chengdu","00 - Default: Any Field
G - Financial Economics",NA
"84","2018-02",111461698,"International:Full-Time Academic (Permanent, Tenure Track or Tenured)","Southwestern University of Finance and Economics",NA,"Survey and Research Center for China Household Finance","Economics
Finance
Management","All Ranks","The Survey and Research Center for China Household Finance (CHFS) of the Southwestern University of Finance and Economics (SWUFE) in Chengdu, China invites applications for a number of tenure-track and tenured positions in all fields of economics, finance, and management. The compensation package includes salary starting at RMB 350,000, research fund, and a housing allowance of RMB 180,000. We are especially looking for applicants with interest and capability in policy-relevant research. 

SWUFE, located in historic but affordable Chengdu, is one of the best universities in China and the largest Chinese university specializing in economics and management with more than 20,000 full-time students. CHFS is one of China's best-known think tanks. Building databases, including data collection and integration, is one main task of CHFS. In addition, CHFS promotes policy and academic research on real estate, income distribution, family finance, urban and rural governance, and other fields. CHFS also conducts field experiments to explore and develop theory and practical applications for income distribution system reforms and anti-poverty policies.

For more information about us, please visit https://chfs.swufe.edu.cn/","350,000 RMB",NA,NA,"CHINA Sichuan Chengdu","00 - Default: Any Field","2018-12-01 00:00:00"
"85","2018-02",111461812,"US: Other Academic (Visiting or Temporary)","Stanford University","Shorenstein Asia Pacific Research Center","Asia Health Policy Program","Health Policy Postdoc Fellowship","Asia Health Policy Postdoctoral Fellowship","The Asia Health Policy Program (AHPP) at the Shorenstein Asia-Pacific Research Center at Stanford University invites applicants for the 2019-20 Asia Health Policy postdoctoral fellowship. The postdoctoral fellow participates in AHPP while undertaking original research on contemporary health or healthcare policy of high relevance to low- and middle-income countries in the Asia-Pacific region. Applicants from low-income or lower-middle-income countries in the Asia-Pacific receive priority.
 
The fellowships are limited to recent PhDs (with degree conferral within the past 3 years and no later than July 31, 2019). Postdoctoral fellows are required to be in residence for the duration of the appointment, to take part in program activities, present their research findings, and participate in the Center<U+2019>s publication program. The postdoctoral fellowship is a 10-month appointment with a salary rate of $52,000, or commensurate with Stanford policy, plus $2,000 for research expenses.

Submit a Cover letter, Curriculum vitae, and a short research statement, and arrange for two letters of recommendation to be emailed directly to llee888@stanford.edu. The deadline to apply is Monday, January 7, 2019.  
For more information, see https://aparc.fsi.stanford.edu/education/fellowship-and-training-opportunities/asia-health-policy-postdoctoral-fellowship.
","52000",NA,NA,"UNITED STATES California Stanford","I1 - Health","2019-01-07 00:00:00"
"86","2018-02",111461904,"Full-Time Nonacademic","StataCorp LP",NA,NA,"Econometrics
Stata
Statistical software
Communication","Senior Econometrician, Educational Services","StataCorp is seeking an individual with a passion for communication, in particular, communication about Stata and about econometrics.

In this position, you will train and interact with academic and professional economists and with other social scientists.  You will develop and give talks that introduce specific features of Stata.  Because Stata offers a diverse set of features, talks may cover data management, graphics, time series, panel data, treatment effects, dynamic stochastic general equilibrium models, and more.  The qualified applicant need not be an expert in all of these areas but must have a solid knowledge of econometrics and be excited to learn more about both Stata and advanced econometrics applications.

In addition to giving talks, this position may involve other methods of communication such as writing blog posts, interacting with Stata users on social media, and presenting webinars.

Requirements:

  - Experience using Stata
  - Solid knowledge of econometrics
  - Passion for communication and teaching
  - Travel approximately 15 weeks per year
  - PhD in econometrics0 or economics or a master's degree

This position is based in College Station, TX.",NA,NA,NA,"UNITED STATES Texas College Station","C - Mathematical and Quantitative Methods","2018-12-10 00:00:00"
"87","2018-02",111461915,"US: Full-Time Academic (Permanent, Tenure Track or Tenured)","Stephen F. Austin State University","Rusche College of Business","Economics and Finance","Microeconomics
Statistics","Assistant Professor","The Department of Economics and Finance invites applications for a tenure-track faculty position in Economics, beginning in Fall 2019.

Teaching assignments can vary but may include principles of microeconomics, principles of macroeconomics, intermediate microeconomics and courses in the candidate<U+2019>s field. Preference will be given to candidates who can also teach business statistics.

Teaching load is nine hours per semester.

Faculty are expected to pursue research that leads to publications in refereed journals.

Other duties include participation in service at the department, college, and university levels; student advising, and other duties as assigned.

Minimum Qualifications: PhD in Economics from an accredited institution. ABD candidates will be considered, provided there is evidence that degree is near completion.

Review of applications will begin immediately and continue until the position is filled.

To apply, fill out an application at the link below. Submit a CV, letter of interest, contact information for three references, and a writing sample (job market paper). Official transcripts will be required upon hire.",NA,NA,NA,"UNITED STATES Texas Nacogdoches","00 - Default: Any Field
A - General Economics and Teaching
D - Microeconomics
E - Macroeconomics and Monetary Economics","2019-01-31 00:00:00"
"88","2018-02",111461784,"Other Nonacademic (Temporary, Part-Time, Non-Salaried, Consulting, Etc.)","T. Rowe Price",NA,NA,NA,"Quantitative Analyst  Equity Quantitative Research  (ASSA Conference Attendees Only)","About the Equity Quantitative Group
Serves as an integral part of the firm<U+2019>s Equity division and is based in Baltimore. The eleven-member team manages six distinct long-only and long-short strategies with current AUM of ~$10 billion (as of June 30, 2018). The team is supported by a dedicated group of IT specialists.  The quantitative equity group is expanding and would like to add experienced analysts and portfolio managers

About the Equity Quantitative Research Group
Serve as an integral part of the firm<U+2019>s Equity division. The ten-member team, which is supported by a dedicated group of IT specialists, has the following responsibilities:

o Manage equity portfolios.
o Develop stock selection models and screens for all global regions;
o Publish white papers for the group<U+2019>s clients
o Work with fundamental portfolio managers based in our global offices who would like to use quant resources to help enhance their investment processes and decisions;
o Solve analytical problems encountered by portfolio managers and analysts;
o Collaborate with separate quantitative investment groups in Fixed Income and Multi-Asset on joint projects; and
o Help the firm<U+2019>s institutional marketing efforts by leveraging the group<U+2019>s expertise.
Principal Responsibilities
o Perform rigorous quantitative/statistical research in finance to develop new stock selection models and enhance current models.
o Independently identify and analyze topics relevant to stock selection and portfolio management.
o Work closely with fundamental portfolio managers and analysts to help them use insights from quantitative stock selection models.
o Conduct research and analysis on other investment management topics, such as attribution and portfolio construction.
o Keep abreast of industry and academic research to generate innovative insights.

Preferred
o Ph.D., MBA/MS in Finance or Accounting or an MBA with a Quantitative Finance specialization.
o Prior experience in the financial services industry in quantitative equity research.
o Experience conducting empirical research and working with large financial data sets.

Required
o Advanced degree in a relevant field with strong credentials, strong academic background, and/or relevant work experience
o Exceptional quantitative and finance skills
o Superb skills in communicating with technical and non-technical associates and clients; and desire to work in a highly collaborative group
o A high-level understanding of finance, investing, and economics
o Excellent  skills in statistics/econometrics and proficiency in programming languages, such as R, Python or Matlab, and a demonstrated ability at applying those skills to modeling problems
o CFA charter or commitment to obtain one",NA,NA,NA,"UNITED STATES Maryland Baltimore","00 - Default: Any Field","2019-01-31 00:00:00"
